<!ELEMENT Address ( Company+ ) >

<!ELEMENT Company ( Name+, Employee+ ) >

<!ELEMENT Employee ( Name, Rank ) >

<!ELEMENT Name ( #PCDATA ) >

<!ELEMENT Rank ( #PCDATA ) >

