<?xml version="1.0" encoding="UTF-8"?>
<!DOCTYPE Address SYSTEM "Address.dtd">
<Address>
	<Company>
		<Name>xyz Corp.</Name>
		<Employee>
			<Name>John Doe</Name>
			<Rank>Software Engineer</Rank>
		</Employee>
		<Employee>
			<Name>Mary Powers</Name> 
			<Rank>Senior Software Engineer</Rank>
		</Employee>
	</Company>
</Address>